{
  "$schema": "https://json-schema.org/draft/2020-12/schema",
  "$id": "https://example.invalid/telecom/observations/telecom-observation-v2.schema.json",
  "title": "TelecomObservationV2",
  "type": "object",
  "properties": {
    "schemaVersion": {
      "const": 2
    },
    "eventId": {
      "type": "string",
      "format": "uuid",
      "pattern": "^[0-9a-f]{8}-[0-9a-f]{4}-[0-9a-f]{4}-[0-9a-f]{4}-[0-9a-f]{12}$"
    },
    "sourceId": {
      "type": "string",
      "pattern": "^[A-Z][A-Z0-9]*(?:-[A-Z0-9]+)*$",
      "maxLength": 64
    },
    "scopeId": {
      "type": "string",
      "pattern": "^[A-Z][A-Z0-9]*(?:-[A-Z0-9]+)*$",
      "maxLength": 64
    },
    "kind": {
      "enum": [
        "SERVICE",
        "NODE",
        "HEARTBEAT"
      ]
    },
    "windowStart": {
      "type": "string",
      "format": "date-time",
      "pattern": "^\\d{4}-\\d{2}-\\d{2}T\\d{2}:\\d{2}:00Z$"
    },
    "windowEnd": {
      "type": "string",
      "format": "date-time",
      "pattern": "^\\d{4}-\\d{2}-\\d{2}T\\d{2}:\\d{2}:00Z$"
    },
    "emittedAt": {
      "type": "string",
      "format": "date-time",
      "pattern": "^\\d{4}-\\d{2}-\\d{2}T\\d{2}:\\d{2}:\\d{2}(?:\\.\\d{1,3})?Z$"
    },
    "quality": {
      "enum": [
        "COMPLETE",
        "INCOMPLETE",
        "MISSING"
      ]
    },
    "service": {
      "enum": [
        "VOLTE",
        "SMS"
      ]
    },
    "nodeId": {
      "type": "string",
      "pattern": "^[A-Z][A-Z0-9]*(?:-[A-Z0-9]+)*$",
      "maxLength": 64
    },
    "metrics": {
      "type": "object"
    }
  },
  "required": [
    "schemaVersion",
    "eventId",
    "sourceId",
    "scopeId",
    "kind",
    "windowStart",
    "windowEnd",
    "emittedAt",
    "quality"
  ],
  "additionalProperties": false,
  "$defs": {
    "volteMetrics": {
      "type": "object",
      "properties": {
        "attempts": {
          "type": "integer",
          "minimum": 0,
          "maximum": 9007199254740991
        },
        "technicalSuccesses": {
          "type": "integer",
          "minimum": 0,
          "maximum": 9007199254740991
        },
        "technicalFailures": {
          "type": "integer",
          "minimum": 0,
          "maximum": 9007199254740991
        },
        "userOutcomes": {
          "type": "integer",
          "minimum": 0,
          "maximum": 9007199254740991
        },
        "rrcAttempts": {
          "type": "integer",
          "minimum": 0,
          "maximum": 9007199254740991
        },
        "rrcSuccesses": {
          "type": "integer",
          "minimum": 0,
          "maximum": 9007199254740991
        },
        "bearerAttempts": {
          "type": "integer",
          "minimum": 0,
          "maximum": 9007199254740991
        },
        "bearerSuccesses": {
          "type": "integer",
          "minimum": 0,
          "maximum": 9007199254740991
        },
        "sip503Count": {
          "type": "integer",
          "minimum": 0,
          "maximum": 9007199254740991
        }
      },
      "required": [
        "attempts",
        "technicalSuccesses",
        "technicalFailures",
        "userOutcomes",
        "rrcAttempts",
        "rrcSuccesses",
        "bearerAttempts",
        "bearerSuccesses",
        "sip503Count"
      ],
      "additionalProperties": false
    },
    "smsMetrics": {
      "type": "object",
      "properties": {
        "deliveryAttempts": {
          "type": "integer",
          "minimum": 0,
          "maximum": 9007199254740991
        },
        "deliverySuccesses": {
          "type": "integer",
          "minimum": 0,
          "maximum": 9007199254740991
        },
        "deliveredMessages": {
          "type": "integer",
          "minimum": 0,
          "maximum": 9007199254740991
        },
        "deliveryDelayMs": {
          "type": "array",
          "items": {
            "type": "number",
            "minimum": 0
          },
          "maxItems": 10000
        }
      },
      "required": [
        "deliveryAttempts",
        "deliverySuccesses",
        "deliveredMessages",
        "deliveryDelayMs"
      ],
      "additionalProperties": false
    },
    "nodeMetrics": {
      "type": "object",
      "properties": {
        "cpuPct": {
          "type": "number",
          "minimum": 0,
          "maximum": 100
        },
        "packetLossRatio": {
          "type": "number",
          "minimum": 0,
          "maximum": 1
        },
        "throughputMbps": {
          "type": "number",
          "minimum": 0
        },
        "queueDepth": {
          "type": "integer",
          "minimum": 0,
          "maximum": 9007199254740991
        },
        "oldestPendingAgeSeconds": {
          "type": "number",
          "minimum": 0
        }
      },
      "required": [],
      "additionalProperties": false
    }
  },
  "oneOf": [
    {
      "properties": {
        "kind": {
          "const": "SERVICE"
        }
      },
      "required": [
        "service"
      ],
      "not": {
        "required": [
          "nodeId"
        ]
      },
      "allOf": [
        {
          "if": {
            "properties": {
              "quality": {
                "const": "MISSING"
              }
            }
          },
          "then": {
            "not": {
              "required": [
                "metrics"
              ]
            }
          },
          "else": {
            "required": [
              "metrics"
            ],
            "allOf": [
              {
                "if": {
                  "properties": {
                    "service": {
                      "const": "VOLTE"
                    }
                  }
                },
                "then": {
                  "properties": {
                    "metrics": {
                      "$ref": "#/$defs/volteMetrics"
                    }
                  }
                },
                "else": {
                  "properties": {
                    "metrics": {
                      "$ref": "#/$defs/smsMetrics"
                    }
                  }
                }
              }
            ]
          }
        }
      ]
    },
    {
      "properties": {
        "kind": {
          "const": "NODE"
        }
      },
      "required": [
        "nodeId"
      ],
      "not": {
        "required": [
          "service"
        ]
      },
      "allOf": [
        {
          "if": {
            "properties": {
              "quality": {
                "const": "MISSING"
              }
            }
          },
          "then": {
            "not": {
              "required": [
                "metrics"
              ]
            }
          },
          "else": {
            "required": [
              "metrics"
            ],
            "properties": {
              "metrics": {
                "$ref": "#/$defs/nodeMetrics",
                "minProperties": 1,
                "dependentRequired": {
                  "queueDepth": [
                    "oldestPendingAgeSeconds"
                  ],
                  "oldestPendingAgeSeconds": [
                    "queueDepth"
                  ]
                }
              }
            }
          }
        }
      ]
    },
    {
      "properties": {
        "kind": {
          "const": "HEARTBEAT"
        }
      },
      "not": {
        "anyOf": [
          {
            "required": [
              "service"
            ]
          },
          {
            "required": [
              "nodeId"
            ]
          },
          {
            "required": [
              "metrics"
            ]
          }
        ]
      }
    }
  ]
}
