{
  "schemaVersion": 2,
  "eventId": "8aaa79c8-c0d5-5b03-b4d0-96435c9282fa",
  "sourceId": "SMS-ADAPTER",
  "scopeId": "SMS-MD-ROUTE-A",
  "kind": "SERVICE",
  "windowStart": "2026-09-15T08:00:00Z",
  "windowEnd": "2026-09-15T08:01:00Z",
  "emittedAt": "2026-09-15T08:01:00Z",
  "quality": "COMPLETE",
  "service": "SMS",
  "metrics": {
    "deliveryAttempts": 120,
    "deliverySuccesses": 100,
    "deliveredMessages": 100,
    "deliveryDelayMs": [
      45000,
      45000,
      45000,
      45000,
      45000,
      45000,
      45000,
      45000,
      45000,
      45000,
      45000,
      45000,
      45000,
      45000,
      45000,
      45000,
      45000,
      45000,
      45000,
      45000,
      45000,
      45000,
      45000,
      45000,
      45000,
      45000,
      45000,
      45000,
      45000,
      45000,
      45000,
      45000,
      45000,
      45000,
      45000,
      45000,
      45000,
      45000,
      45000,
      45000,
      45000,
      45000,
      45000,
      45000,
      45000,
      45000,
      45000,
      45000,
      45000,
      45000,
      45000,
      45000,
      45000,
      45000,
      45000,
      45000,
      45000,
      45000,
      45000,
      45000,
      45000,
      45000,
      45000,
      45000,
      45000,
      45000,
      45000,
      45000,
      45000,
      45000,
      45000,
      45000,
      45000,
      45000,
      45000,
      45000,
      45000,
      45000,
      45000,
      45000,
      45000,
      45000,
      45000,
      45000,
      45000,
      45000,
      45000,
      45000,
      45000,
      45000,
      45000,
      45000,
      45000,
      45000,
      45000,
      45000,
      45000,
      45000,
      45000,
      45000
    ]
  }
}
