{
  "schemaVersion": 2,
  "eventId": "c727637d-3729-566a-b338-41927338771e",
  "sourceId": "TRANSPORT-A",
  "scopeId": "VOLTE-MD-CENTRAL",
  "kind": "NODE",
  "windowStart": "2026-09-15T08:00:00Z",
  "windowEnd": "2026-09-15T08:01:00Z",
  "emittedAt": "2026-09-15T08:01:00Z",
  "quality": "COMPLETE",
  "nodeId": "TRANSPORT-A",
  "metrics": {
    "packetLossRatio": 0.001,
    "throughputMbps": 120
  }
}
